{
  "$schema": "../../schemas/RoomSpec.schema.json",
  "id": "scotus_lobby",
  "name": "Supreme Court Lobby",
  "description": "The grand entrance hall of the Supreme Court building",
  "width": 20,
  "height": 15,
  "tileset": "tileset.scotus_tiles",
  "background": "#1a1a2e",
  "music": "lobby_ambient",
  "environment": "interior",
  "entities": [
    {
      "type": "PlayerSpawn",
      "x": 10,
      "y": 13,
      "id": "spawn_main"
    },
    {
      "type": "PlayerSpawn",
      "x": 10,
      "y": 14,
      "id": "spawn_exterior",
      "properties": {
        "_comment": "Spawn point when entering from courthouse steps"
      }
    },
    {
      "type": "NPC",
      "x": 5,
      "y": 7,
      "id": "npc_clerk",
      "properties": {
        "name": "Court Clerk",
        "characterId": "npc.clerk_01",
        "storyKnot": "court_clerk_intro"
      }
    },
    {
      "type": "EncounterTrigger",
      "x": 15,
      "y": 7,
      "id": "encounter_thomas",
      "properties": {
        "justiceId": "justice_thomas",
        "name": "Justice Thomas",
        "deckTag": "evidence",
        "count": 1,
        "rewardId": "evidence_blazer",
        "once": true
      }
    },
    {
      "type": "OutfitChest",
      "x": 18,
      "y": 12,
      "id": "chest_starter",
      "properties": {
        "outfitId": "civpro_suit"
      }
    },
    {
      "type": "Door",
      "x": 10,
      "y": 1,
      "id": "door_courtroom",
      "properties": {
        "doorId": "door_004",
        "fromRoomId": "scotus_lobby",
        "toRoomId": "courtroom_main",
        "toSpawnTag": "spawn_main",
        "targetLevel": "courtroom_main",
        "locked": true,
        "requiredItem": "all_justice_victories"
      }
    },
    {
      "type": "Door",
      "x": 10,
      "y": 14,
      "id": "door_exterior",
      "properties": {
        "doorId": "door_005",
        "fromRoomId": "scotus_lobby",
        "toRoomId": "courthouse_exterior",
        "toSpawnTag": "spawn_street",
        "targetLevel": "courthouse_exterior",
        "sprite": "door_courthouse"
      }
    },
    {
      "type": "Prop",
      "x": 3,
      "y": 4,
      "id": "lobby_tree_left",
      "properties": {
        "sprite": "prop.lpc_tree_17",
        "collision": false
      }
    },
    {
      "type": "Prop",
      "x": 17,
      "y": 4,
      "id": "lobby_tree_right",
      "properties": {
        "sprite": "prop.lpc_tree_19",
        "collision": false
      }
    },
    {
      "type": "Prop",
      "x": 10,
      "y": 12,
      "id": "door_prop_lobby",
      "properties": {
        "sprite": "prop.lpc_door_double_white_glass_01",
        "collision": false
      }
    }
  ],
  "connections": [
    {
      "direction": "north",
      "targetRoom": "courtroom_main",
      "locked": true,
      "requiredItem": "all_justice_victories"
    },
    {
      "direction": "south",
      "targetRoom": "courthouse_exterior",
      "spawnId": "spawn_street"
    }
  ]
}
