{
    "$schema": "../schemas/RoomSpec.schema.json",
    "id": "scotus_lobby",
    "name": "SCOTUS Main Lobby",
    "description": "The grand main lobby of the Supreme Court building",
    "width": 20,
    "height": 15,
    "tileset": "scotus_floors",
    "background": "#1a1a2e",
    "environment": "interior",
    "entities": [
        {
            "type": "PlayerSpawn",
            "x": 9,
            "y": 12,
            "id": "main",
            "properties": {}
        },
        {
            "type": "PlayerSpawn",
            "x": 9,
            "y": 13,
            "id": "from_exterior",
            "properties": {}
        },
        {
            "type": "PlayerSpawn",
            "x": 9,
            "y": 1,
            "id": "from_hallway",
            "properties": {}
        },
        {
            "type": "PlayerSpawn",
            "x": 1,
            "y": 7,
            "id": "from_courtroom",
            "properties": {}
        },
        {
            "type": "PlayerSpawn",
            "x": 18,
            "y": 7,
            "id": "from_library",
            "properties": {}
        },
        {
            "type": "Door",
            "x": 8,
            "y": 14,
            "id": "scotus_lobby_to_courthouse_exterior",
            "properties": {
                "targetLevel": "courthouse_exterior"
            }
        },
        {
            "type": "Door",
            "x": 9,
            "y": 0,
            "id": "scotus_lobby_to_hallway",
            "properties": {
                "targetLevel": "hallway"
            }
        },
        {
            "type": "Door",
            "x": 0,
            "y": 7,
            "id": "scotus_lobby_to_courtroom_main",
            "properties": {
                "targetLevel": "courtroom_main"
            }
        },
        {
            "type": "Door",
            "x": 19,
            "y": 7,
            "id": "scotus_lobby_to_library",
            "properties": {
                "targetLevel": "library"
            }
        }
    ],
    "connections": [
        {
            "direction": "south",
            "targetRoom": "courthouse_exterior",
            "locked": false
        },
        {
            "direction": "north",
            "targetRoom": "hallway",
            "locked": false
        }
    ]
}